run,scenario_id,boundary_id,direction,flip_type,mechanism,safety_sensitive,opening_query,hidden_fact,expected_initial_label,expected_final_label,initial_labels,initial_category_present,initial_exact_present,plausible_initial_present,follow_up_question_count,follow_up_questions,question_matched,matched_question,final_labels,final_category_present,final_exact_present,expected_final_category_present_initially,expected_final_exact_present_initially,expected_final_category_added,expected_final_exact_added,expected_final_exact_lost,provider_error,latency_ms
variability_b2_20260719T071320Z,v2_divorce_context_10,divorce_context,AtoB,routing_disambiguation,M3_missing_procedural_or_institutional_fact,false,I'm leaving my marriage and I have no income of my own right now. What am I entitled to?,I gave up my nursing career for 12 years to raise our kids while he built his practice — long-term support is the entire fight.,Family Law > General (Divorce/Separation etc.),Family Law > Spousal Support,Family Law > General (Divorce/Separation etc.) || Family Law > Spousal Support || Administrative Law > General (State),True,True,True,3,"Are you mainly asking about money support from your spouse, about the overall split (property/debts/kids), or both? || Do you have children with your spouse? || Who owns the home — you, your spouse, or both of you?",True,"Are you mainly asking about money support from your spouse, about the overall split (property/debts/kids), or both?",,,,True,True,False,False,False,,46189
variability_b2_20260719T071320Z,v2_divorce_context_41,divorce_context,AtoB,routing_disambiguation,M3_missing_procedural_or_institutional_fact,false,My husband handles all our money and I found out he's been hiding accounts as we head toward divorce.,I can't afford full representation at all — legal aid suggested coaching: someone to guide my own discovery requests and filings step by step.,Family Law > General (Divorce/Separation etc.),Family Law > Pro Se Coaching,Family Law > General (Divorce/Separation etc.) || Debtor/Creditor > General (Debtor) || Family Law > Spousal Support,True,True,True,2,"Are you looking for help with the divorce itself, or with the hidden money accounts? || Who owns the home — you, your husband, or both of you?",False,,,,,True,False,False,False,False,,42135
variability_b2_20260719T071320Z,v2_divorce_context_44,divorce_context,BtoA,routing_disambiguation,M3_missing_procedural_or_institutional_fact,false,I need a military divorce attorney — my husband retired from the Army last year and everything is pensions and benefits.,"The divorce itself finished in mediation — all that's left is drafting the military-pension division order correctly, which is specialized drafting, not a contested case.",Family Law > Military,Family Law > QDROs,Family Law > Military || Family Law > General (Divorce/Separation etc.) || Family Law > QDROs,True,True,True,1,"Are you looking for help with your own military pension and benefits, or your husband's?",False,,,,,True,True,False,False,False,,11071
variability_b2_20260719T071320Z,v2_divorce_context_61,divorce_context,AtoB,routing_disambiguation,M3_missing_procedural_or_institutional_fact,false,"My wife and I are done, but our biggest asset is my pension that doesn't pay out for nine more years.","We've settled everything else by agreement — drafting the pension division order correctly, with survivor elections and the nine-year horizon, IS the remaining case.",Family Law > General (Divorce/Separation etc.),Family Law > QDROs,Family Law > General (Divorce/Separation etc.) || Family Law > QDROs || Labor & Employment > Pensions/Benefits/ERISA - Employee,True,True,True,3,"Where are you in the process of ending the marriage and dealing with the pension? || Are you looking for help with ending your marriage, or with understanding your pension benefits? || Who owns the pension — you, your wife, or both of you?",True,"Are you looking for help with ending your marriage, or with understanding your pension benefits?",,,,True,True,False,False,False,,47066
variability_b2_20260719T071320Z,v2_divorce_context_65,divorce_context,AtoB,routing_disambiguation,M3_missing_procedural_or_institutional_fact,false,After thirty years my parents are divorcing and my mother has never once paid a bill or seen a statement.,"Mom's early dementia complicates everything — she may lack capacity to instruct divorce counsel, and whether I need protective authority for her comes before the divorce can even proceed.",Family Law > General (Divorce/Separation etc.),Wills & Trusts > Power of Attorney,Family Law > General (Divorce/Separation etc.) || Family Law > Spousal Support || Wills & Trusts > General (Wills/Trusts/Estates),True,True,True,3,"What kind of help do you want for your mother right now? || Are you asking about the divorce itself, or about how your parents' property and money will be divided? || Who owns the home — your mom, your dad, or both of them?",True,What kind of help do you want for your mother right now?,Family Law > General (Divorce/Separation etc.) || Wills & Trusts > Conservatorship/Guardianship,True,False,True,False,False,False,False,,45755
variability_b2_20260719T071320Z,v2_divorce_context_66,divorce_context,BtoA,routing_disambiguation,M3_missing_procedural_or_institutional_fact,false,"My husband served me papers, and his family's lawyer 'generously' offered to handle everything for both of us.","I've realized the 'shared lawyer' represents HIM — the proposed terms give him the house and my retirement; I need my own full representation, not a document check.",Family Law > Document Review,Family Law > General (Divorce/Separation etc.),Family Law > General (Divorce/Separation etc.) || Family Law > Document Review || Family Law > Pro Se Coaching,True,True,True,3,"What papers did your husband have you served with? || Do you and your husband have any kids under 18 together? || Do you want help just understanding the papers, or help with the whole divorce process?",True,"Do you want help just understanding the papers, or help with the whole divorce process?",Family Law > General (Divorce/Separation etc.) || Family Law > Document Review || Family Law > Spousal Support,True,True,True,True,False,False,False,,46244
variability_b2_20260719T071320Z,v2_employment_paper_and_pay_04,employment_paper_and_pay,AtoB,routing_disambiguation,M3_missing_procedural_or_institutional_fact,false,I was disciplined at my job unfairly and I want to fight it through every channel I have.,I'm a state corrections officer — civil service rules give me an appeal to the personnel board with a 15-day deadline.,Labor & Employment > General - Employee,Labor & Employment > Public Employees - Employee,Labor & Employment > General - Employee || Labor & Employment > Discrimination - Employee || Labor & Employment > Wrongful Discharge - Employee,True,True,True,2,What do you think is the main reason your job disciplined you? || What are you trying to do about the discipline?,True,What do you think is the main reason your job disciplined you?,Labor & Employment > Public Employees - Employee || Administrative Law > General (State) || Administrative Law > Professional Licensing,True,True,True,False,False,True,False,,39440
variability_b2_20260719T071320Z,v2_employment_paper_and_pay_06,employment_paper_and_pay,BtoA,routing_disambiguation,M3_missing_procedural_or_institutional_fact,false,I have a wage claim against my old employer but there's a complication I didn't expect.,"The company just filed Chapter 7 — I got a bankruptcy notice, and my unpaid wages are now a priority claim I have to file in that case.",Labor & Employment > Wage and Hour Claims - Employee,Bankruptcy > Creditors,Labor & Employment > Wage and Hour Claims - Employee || General Litigation > Health Law/HIPAA || Labor & Employment > Wage and Hour Claims - Employer,True,True,True,3,What is the complication? || What is the complication you are facing with your wage claim? || What is the complication you didn't expect?,True,What is the complication?,Bankruptcy > Creditors || Labor & Employment > Wage and Hour Claims - Employee,True,True,False,False,True,True,False,,30092
variability_b2_20260719T071320Z,v2_employment_paper_and_pay_46,employment_paper_and_pay,AtoB,routing_disambiguation,M3_missing_procedural_or_institutional_fact,false,My new job's offer letter promised a signing bonus and relocation that never appeared in my paychecks.,"They've now offered a 'correction agreement' paying half if I release all claims and extend my non-compete — that document needs review before Friday, whatever else happens.",Labor & Employment > Wage and Hour Claims - Employee,Labor & Employment > Document Review/Severance Packages - Employee,Labor & Employment > Wage and Hour Claims - Employee || Labor & Employment > General - Employee || Administrative Law > Unemployment,True,True,True,2,"Was the signing bonus/relocation pay written in your offer letter, and have you met any conditions (like staying a certain number of months)? || Did your employer give you a written contract or offer letter that mentions the signing bonus and relocation payment?",False,,,,,True,False,False,False,False,,19898
variability_b2_20260719T071320Z,v2_estate_posture_07,estate_posture,AtoB,routing_disambiguation,M3_missing_procedural_or_institutional_fact,false,My grandfather left me and my niece the family home but there are complications with taking it over.,The 'complication' is a reverse mortgage — the lender has already scheduled a foreclosure auction unless we act fast.,Wills & Trusts > Probate,Real Property > Foreclosure,Wills & Trusts > Probate || Real Property > General (Residential) || General Litigation > Malpractice-Medical,True,True,True,3,"Did your grandfather leave a will, and has a probate case (court process to transfer property after someone dies) been started? || What is the biggest thing making it hard to take over the house? || What do you and your niece want to do with the house?",True,What is the biggest thing making it hard to take over the house?,"Real Property > Foreclosure || Wills & Trusts > Probate || Real Property > Government Loans (VA, FHA, etc.)",True,True,True,False,False,True,False,,30434
variability_b2_20260719T071320Z,v2_estate_posture_08,estate_posture,AtoB,routing_disambiguation,M3_missing_procedural_or_institutional_fact,false,"We're deciding whether to transfer ownership of a property or put it in a trust, and we need advice.","The property carries a VA construction loan tied to my husband's disabled-veteran status, and the transfer can't jeopardize that loan or his property-tax exemption.",Wills & Trusts > General (Wills/Trusts/Estates),"Real Property > Government Loans (VA, FHA, etc.)",Wills & Trusts > General (Wills/Trusts/Estates) || Wills & Trusts > Living Trusts || Wills & Trusts > Document Review,True,True,True,3,Is your main goal estate planning (avoid probate and plan for what happens after death) or to gift/sell the property right now? || What kind of property is it? || Who owns the property now?,False,,,,,False,False,False,False,False,,25993
variability_b2_20260719T071320Z,v2_estate_posture_11,estate_posture,AtoB,routing_disambiguation,M3_missing_procedural_or_institutional_fact,false,My father remarried late in life and now his new wife controls everything he owned. We're worried.,"Dad has advancing dementia, and she had him sign a new will and deed at home two months after his diagnosis, with her own notary.",Wills & Trusts > Litigation,Wills & Trusts > Elder Abuse,Wills & Trusts > Elder Abuse || Wills & Trusts > Conservatorship/Guardianship || Wills & Trusts > Power of Attorney,True,False,True,3,"Is your father still alive? || What are you most worried about right now? || Do you know if your father recently signed any papers that gave his new wife control, like a power of attorney (paper that lets someone make decisions for you), a will (who gets property after death), or a trust (legal way to hold/manage property)?",True,"Do you know if your father recently signed any papers that gave his new wife control, like a power of attorney (paper that lets someone make decisions for you), a will (who gets property after death), or a trust (legal way to hold/manage property)?",Wills & Trusts > Litigation || Wills & Trusts > Elder Abuse || Wills & Trusts > Power of Attorney,True,True,True,True,False,False,False,,81120
variability_b2_20260719T071320Z,v2_estate_posture_21,estate_posture,AtoB,routing_disambiguation,M3_missing_procedural_or_institutional_fact,false,I need someone to help me sort out my father's affairs. The paperwork alone fills a table.,"Dad died in February — there's a will naming me executor, and the court process hasn't been started.",Wills & Trusts > General (Wills/Trusts/Estates),Wills & Trusts > Probate,Wills & Trusts > General (Wills/Trusts/Estates) || Wills & Trusts > Probate || Family Law > Other,True,True,True,3,Is your father still alive? || What kind of help do you need most right now? || Did your father have a will?,True,Did your father have a will?,Wills & Trusts > Probate || Wills & Trusts > General (Wills/Trusts/Estates),True,True,True,True,False,False,False,,26334
variability_b2_20260719T071320Z,v2_estate_posture_22,estate_posture,AtoB,routing_disambiguation,M3_missing_procedural_or_institutional_fact,false,My sister was in charge of Mom's money for the last five years and the numbers don't add up.,"Mom is still alive — sister used the POA to move $200,000 into her own accounts while Mom's Alzheimer's worsened, and we need it stopped and recovered now.",Wills & Trusts > Probate,Wills & Trusts > Elder Abuse,Wills & Trusts > Elder Abuse || Wills & Trusts > Power of Attorney || Wills & Trusts > Litigation,True,False,True,3,How was your sister in charge of your mom’s money? || Is your mom still alive? || What do you want most right now?,True,What do you want most right now?,,,,True,True,False,False,False,,61048
variability_b2_20260719T071320Z,v2_estate_posture_46,estate_posture,AtoB,routing_disambiguation,M3_missing_procedural_or_institutional_fact,false,The funeral is Friday and the family is already fighting about who's in charge of everything.,"Mom left a full binder — trust, pour-over will, directives — and what we actually need is someone to read it and tell us who does what; there may be nothing to fight about.",Wills & Trusts > Probate,Wills & Trusts > Document Review,Wills & Trusts > Probate || Wills & Trusts > Litigation || Wills & Trusts > General (Wills/Trusts/Estates),True,True,True,3,"Is the argument mostly about funeral plans right now, or about who controls the person’s money and property (their estate)? || Did the person who died leave a will or trust, and does it name someone to be in charge of the estate (executor/personal representative)? || Has anyone filed papers in probate court to be the person in charge of the estate?",True,"Did the person who died leave a will or trust, and does it name someone to be in charge of the estate (executor/personal representative)?",Wills & Trusts > Document Review || Wills & Trusts > General (Wills/Trusts/Estates) || Wills & Trusts > Living Trusts,True,True,True,False,False,True,False,,62530
variability_b2_20260719T071320Z,v2_estate_posture_62,estate_posture,AtoB,routing_disambiguation,M3_missing_procedural_or_institutional_fact,false,Mom made me joint owner of her house 'to keep it simple' and my siblings are furious now that she's gone.,They've filed a constructive-trust suit claiming the deed was only for convenience — defending my survivorship title in that case is where this lives now.,Wills & Trusts > Probate,Wills & Trusts > Litigation,Wills & Trusts > Litigation || Wills & Trusts > General (Wills/Trusts/Estates) || Real Property > Litigation,True,False,False,2,Was the house deed changed to include your name as a joint owner before your mom passed away? || Did your mom have a will or trust that mentions the house?,True,Was the house deed changed to include your name as a joint owner before your mom passed away?,Wills & Trusts > Litigation || Real Property > Litigation || General Litigation > General Litigation,True,True,True,True,False,False,False,,38556
variability_b2_20260719T071320Z,v2_government_defendant_04,government_defendant,AtoB,label_change,M2_specific_vs_general_fallback,false,I need a civil lawyer because I was hurt during an arrest that never should have happened.,"My lawyer friend says the first step is a tort claim notice against the city within 180 days, and that window is closing next month.",General Litigation > Actions Against Police,General Litigation > Tort Claims Act,General Litigation > Actions Against Police || General Litigation > Personal Injury || General Litigation > Civil Rights,True,True,True,1,Which best fits what happened?,False,,,,,True,False,False,False,False,,9654
variability_b2_20260719T071320Z,v2_government_defendant_08,government_defendant,AtoB,label_change,M2_specific_vs_general_fallback,false,My car was destroyed when a tree limb that everyone knew was dying finally came down on it.,The tree is in the city park strip and the parks department had tagged it for removal a year ago.,General Litigation > Property Damage,General Litigation > Tort Claims Act,General Litigation > Property Damage || General Litigation > Personal Injury || General Litigation > Neighbor Disputes/Nuisance,True,True,True,3,Whose tree was it? || Who owns the tree that fell on your car? || Did you get hurt when the tree fell on your car?,True,Whose tree was it?,General Litigation > Property Damage || General Litigation > Tort Claims Act || Real Property > Land Use/Zoning,True,True,True,False,False,True,False,,20990
variability_b2_20260719T071320Z,v2_government_defendant_21,government_defendant,AtoB,label_change,M2_specific_vs_general_fallback,false,An ambulance crew dropped my father during a transfer and he broke his shoulder.,"It was the county fire department's ambulance — a public agency, with the short government-claim deadline.",General Litigation > Malpractice (Medical),General Litigation > Tort Claims Act,General Litigation > Malpractice (Medical) || General Litigation > Personal Injury || General Litigation > Health Law/HIPAA,True,True,True,2,Was the ambulance service run by the city/county (government) or a private company? || Was the ambulance crew employed by a hospital or a private company?,True,Was the ambulance service run by the city/county (government) or a private company?,General Litigation > Tort Claims Act || General Litigation > Personal Injury || General Litigation > Malpractice (Medical),True,True,True,False,False,True,False,,34946
variability_b2_20260719T071320Z,v2_government_defendant_25,government_defendant,AtoB,label_change,M2_specific_vs_general_fallback,false,My daughter's bus driver slammed the brakes so hard she fractured her wrist bracing.,"It's the school district's own bus and driver — public employer, notice deadline running.",General Litigation > Personal Injury,General Litigation > Tort Claims Act,General Litigation > Personal Injury || General Litigation > Tort Claims Act || General Litigation > Health Law/HIPAA,True,True,True,2,Was your daughter hurt on a school bus (a bus taking students to or from school)? || Who ran the bus the day your daughter got hurt?,True,Who ran the bus the day your daughter got hurt?,,,,True,True,False,False,False,,30797
variability_b2_20260719T071320Z,v2_government_defendant_42,government_defendant,AtoB,label_change,M2_specific_vs_general_fallback,false,My daughter was strip-searched at her school over a rumor about vape pens and she's traumatized.,"We're past the school-policy stage — we want a constitutional case for damages against the district and the administrators personally, and the tort-claim notice clock is running.",Administrative Law > Student Rights,General Litigation > Civil Rights,Administrative Law > Student Rights || Administrative Law > Schools — Special Needs Education || General Litigation > Civil Rights,True,True,True,3,Did this happen at a public school or a private school? || Who made your daughter take her clothes off for the search (strip search)? || Did the school ask you for permission before they did the strip search?,True,Did this happen at a public school or a private school?,,,,True,True,False,False,False,,30922
variability_b2_20260719T071320Z,v2_government_defendant_46,government_defendant,AtoB,label_change,M2_specific_vs_general_fallback,false,Firefighters broke down our door and flooded the house responding to the wrong address.,"It's the city fire bureau — the dispatch record shows the transposed address, and the city's risk office already sent us a claim form with a deadline.",General Litigation > Property Damage,General Litigation > Tort Claims Act,,False,False,False,1,All classifier providers failed to return a response or no labels/questions were found.,False,,,,,False,False,False,False,False,,15370
variability_b2_20260719T071320Z,v2_home_loan_posture_01,home_loan_posture,AtoB,routing_disambiguation,M3_missing_procedural_or_institutional_fact,false,My mortgage company has been impossible to deal with and I'm afraid of losing my house.,A notice of default arrived last week and the letter lists a trustee sale date in September.,Consumer Law > Mortgage Issues (non-foreclosure),Real Property > Foreclosure,Real Property > Foreclosure || Consumer Law > Mortgage Issues (non-foreclosure) || Consumer Law > General,True,True,True,3,"Where are you in the foreclosure (losing your home because of unpaid mortgage) process? || Are you behind on your mortgage payments right now? || Is your mortgage a government-backed loan, like FHA (Federal Housing Administration) or VA (Veterans Affairs)?",True,Where are you in the foreclosure (losing your home because of unpaid mortgage) process?,,,,True,True,False,False,False,,31625
variability_b2_20260719T071320Z,v2_home_loan_posture_03,home_loan_posture,AtoB,routing_disambiguation,M3_missing_procedural_or_institutional_fact,true,We can't afford the house since my husband died and I don't know what my options even are.,The deed and loan are only in his name and his estate was never opened — the lender won't even speak to me until there's a personal representative.,Real Property > Foreclosure,Wills & Trusts > Probate,Real Property > Foreclosure || Wills & Trusts > Probate || Consumer Law > Mortgage Issues (non-foreclosure),True,True,True,3,Whose name is on the house title (deed) right now? || What is the mortgage situation right now (including any foreclosure papers)? || Did your husband leave a will (a paper that says who gets his property after he dies)?,True,Whose name is on the house title (deed) right now?,Wills & Trusts > Probate || Real Property > Foreclosure || Wills & Trusts > General (Wills/Trusts/Estates),True,True,True,True,False,False,False,,34561
variability_b2_20260719T071320Z,v2_home_loan_posture_08,home_loan_posture,BtoA,routing_disambiguation,M3_missing_procedural_or_institutional_fact,false,I co-signed my son's mortgage and now the bank says I'm on the hook for everything.,"The house already sold at auction — what's chasing me now is a $70,000 deficiency judgment they want from my wages and savings.",Real Property > Foreclosure,Debtor/Creditor > General (Debtor),Debtor/Creditor > General (Debtor) || Real Property > Foreclosure || Consumer Law > Mortgage Issues (non-foreclosure),True,True,True,3,"What is the bank doing right now? || Are you an owner of the home, or did you only co-sign the loan? || Is your son behind on the mortgage payments right now?",True,What is the bank doing right now?,Real Property > Foreclosure || Debtor/Creditor > Judgment Collection || Debtor/Creditor > General (Creditor),True,False,True,True,False,False,True,,36095
variability_b2_20260719T071320Z,v2_home_loan_posture_25,home_loan_posture,AtoB,routing_disambiguation,M3_missing_procedural_or_institutional_fact,false,A man came to our door offering to 'save' the house and now the deed isn't in our name anymore.,"We signed what he called 'paperwork to pause the sale' — it was a deed transfer to his LLC, and we need a suit to void it and quiet title back to us.",Real Property > Foreclosure,Real Property > Litigation,Real Property > Foreclosure || Consumer Law > Mortgage Issues (non-foreclosure) || Real Property > Litigation,True,True,True,3,"When this man came to your door, were you behind on your mortgage payments or facing foreclosure (the bank taking the home)? || Did you sign anything that gave him the deed (the paper that shows who owns the home) or let him take over the home? || What is your living situation right now?",True,Did you sign anything that gave him the deed (the paper that shows who owns the home) or let him take over the home?,Real Property > Litigation || Consumer Law > General || Real Property > Foreclosure,True,True,True,True,False,False,False,,35110
variability_b2_20260719T071320Z,v2_immigration_posture_03,immigration_posture,BtoA,routing_disambiguation,M3_missing_procedural_or_institutional_fact,true,They're trying to deport my brother and our whole family is falling apart over it.,"The removal case is entirely built on his old guilty plea — his defense lawyer never warned him it was deportable, and we're told vacating that plea is the path.",International Law > Deportation,Criminal Law > Post Conviction/Appeals,International Law > Deportation || Family Law > Other,True,True,True,1,What’s your brother’s current situation with immigration?,False,,,,,False,False,False,False,False,,8855
