run,scenario_id,boundary_id,direction,flip_type,mechanism,safety_sensitive,opening_query,hidden_fact,expected_initial_label,expected_final_label,initial_labels,initial_category_present,initial_exact_present,plausible_initial_present,follow_up_question_count,follow_up_questions,question_matched,matched_question,final_labels,final_category_present,final_exact_present,expected_final_category_present_initially,expected_final_exact_present_initially,expected_final_category_added,expected_final_exact_added,expected_final_exact_lost,provider_error,latency_ms
variability_b1_20260719T015046Z,v2_benefit_agency_06,benefit_agency,BtoA,routing_disambiguation,M3_missing_procedural_or_institutional_fact,false,My daughter keeps getting in trouble at school and I think it's connected to her struggles.,"She has diagnosed ADHD and dyslexia, and the school refuses to evaluate her for an IEP — the 'trouble' is them disciplining her disability.",Administrative Law > Student Rights,Administrative Law > Schools — Special Needs Education,Administrative Law > Schools — Special Needs Education || Administrative Law > Student Rights || Family Law > Juvenile/DHS Issues,True,True,True,3,"What is the biggest problem at school right now? || Does your daughter have an IEP (Individualized Education Program) or a 504 plan (a school support plan for a disability)? || Is the school public, private, or a charter school?",True,What is the biggest problem at school right now?,Administrative Law > Schools — Special Needs Education || Administrative Law > Student Rights || Family Law > Juvenile/DHS Issues,True,True,True,True,False,False,False,,46465
variability_b1_20260719T015046Z,v2_benefit_agency_10,benefit_agency,AtoB,routing_disambiguation,M3_missing_procedural_or_institutional_fact,false,Our small counseling practice got a letter terminating our biggest contract without cause and it will sink us.,"The contract is with the state's Medicaid coordinated-care organization — 235 of our clients are covered through it, so this is a Medicaid provider-network fight.","Business and Corporate > General (contracts, entities)",Administrative Law > Medicare/Medicaid,"Business and Corporate > General (contracts, entities) || Business and Corporate > Litigation || General Litigation > Health Law/HIPAA",True,True,True,3,Who sent the letter ending the contract? || Does the contract say they can end it “without cause” (without giving a reason)? || What do you want most right now?,False,,,,,False,False,False,False,False,,35008
variability_b1_20260719T015046Z,v2_benefit_agency_13,benefit_agency,BtoA,routing_disambiguation,M3_missing_procedural_or_institutional_fact,false,I was let go unfairly and now I have no income coming in at all. I need legal help this week.,The urgent piece is my unemployment denial — my appeal hearing with the state is Tuesday and I can't do it alone.,Labor & Employment > Wrongful Discharge - Employee,Administrative Law > Unemployment,Labor & Employment > Wrongful Discharge - Employee || Labor & Employment > Discrimination - Employee,True,True,True,2,"What do you think is the main reason you were fired or let go? || When you were hired, did you sign a written work contract or have a union agreement?",True,What do you think is the main reason you were fired or let go?,,,,False,False,False,False,False,,34971
variability_b1_20260719T015046Z,v2_benefit_agency_26,benefit_agency,AtoB,routing_disambiguation,M3_missing_procedural_or_institutional_fact,false,The pharmacy board flagged my dispensing records and suspended me while they 'investigate'.,Federal agents served a subpoena on the pharmacy the same week — my lawyer friend says the parallel criminal fraud investigation is the bigger danger.,Administrative Law > Professional Licensing,Criminal Law > White Collar Crime,Administrative Law > Professional Licensing || Criminal Law > Other,True,True,True,3,Who is taking action against you right now? || Are you a pharmacist or pharmacy technician? || Did the board say you might have done something wrong?,True,Who is taking action against you right now?,Administrative Law > Professional Licensing || Criminal Law > White Collar Crime || Administrative Law > General (Federal),True,True,True,False,False,True,False,,33320
variability_b1_20260719T015046Z,v2_benefit_agency_44,benefit_agency,AtoB,routing_disambiguation,M3_missing_procedural_or_institutional_fact,false,The housing authority terminated our rental assistance over paperwork we never received.,"It's our Section 8 voucher — the termination skipped the informal hearing HUD rules require, and our landlord starts eviction the day the subsidy stops.",Administrative Law > Welfare,Real Property > Section 8/HUD,Real Property > Section 8/HUD || Real Property > Tenant (Residential) || Administrative Law > Welfare,True,True,True,3,"Which type of rental assistance is this? || Are you trying to get your rental assistance back, or are you trying to fight being removed from the housing program? || Did you get a notice that you were behind on paperwork?",True,Which type of rental assistance is this?,Real Property > Section 8/HUD || Real Property > Tenant (Residential) || Administrative Law > Unemployment,True,True,True,True,False,False,False,,22869
variability_b1_20260719T015046Z,v2_benefit_agency_46,benefit_agency,AtoB,routing_disambiguation,M3_missing_procedural_or_institutional_fact,false,"The state overpaid me pandemic unemployment through their own error and now wants $23,000 with penalties.","I lost my waiver appeal — the debt is final, collection has begun, and with my other debts the realistic question is whether bankruptcy reaches an agency overpayment.",Administrative Law > Unemployment,Bankruptcy > Personal,Administrative Law > Unemployment || Debtor/Creditor > General (Debtor) || Debtor/Creditor > Judgment Collection,True,True,True,1,"Are you trying to get help with the unemployment benefits themselves, or with the debt and penalties you owe?",True,"Are you trying to get help with the unemployment benefits themselves, or with the debt and penalties you owe?",Bankruptcy > Personal || Administrative Law > Unemployment || Debtor/Creditor > Collection/Harassment,True,True,False,False,True,True,False,,18178
variability_b1_20260719T015046Z,v2_benefit_agency_61,benefit_agency,AtoB,routing_disambiguation,M3_missing_procedural_or_institutional_fact,false,The state suspended my foster-parent certification over an allegation that was withdrawn the next day.,They also removed our foster daughter of two years during the suspension — getting her placement back through the dependency court is the fight that matters most.,Administrative Law > General (State),Family Law > Juvenile/DHS Issues,Administrative Law > Professional Licensing || Family Law > Juvenile/DHS Issues || Administrative Law / General (State),True,False,False,3,"Is your main goal to challenge the state agency’s suspension of your foster‑parent certification, or is this mostly about a child welfare case involving a specific child? || Did you get a letter or notice about the suspension? || Do you want to get your certification back?",True,"Is your main goal to challenge the state agency’s suspension of your foster‑parent certification, or is this mostly about a child welfare case involving a specific child?",Family Law > Juvenile/DHS Issues || Administrative Law > Professional Licensing || Administrative Law > General (State),True,True,True,True,False,False,False,,26589
variability_b1_20260719T015046Z,v2_benefit_agency_63,benefit_agency,AtoB,routing_disambiguation,M3_missing_procedural_or_institutional_fact,false,Our church's food pantry got shut down by an inspector over rules we've never heard of.,The citation hinges on our nonprofit status paperwork — our 501(c)(3) food-handling exemption lapsed when a filing was missed; restoring the nonprofit compliance stack reopens us.,Administrative Law > General (Local/Municipal),Business and Corporate > Non-Profit,Administrative Law > General (Local/Municipal) || Business and Corporate > Non-Profit || Administrative Law > General (State),True,True,True,2,"What kind of inspector or agency shut down the church food pantry? || Did they give you anything in writing (like a notice, citation, or shutdown order) that says what rule you broke?",True,"Did they give you anything in writing (like a notice, citation, or shutdown order) that says what rule you broke?",,,,True,True,False,False,False,,35071
variability_b1_20260719T015046Z,v2_business_entity_specifics_01,business_entity_specifics,AtoB,routing_disambiguation,M2_specific_vs_general_fallback,false,I'm starting an organization with two friends and we need help setting it up properly.,It's a charity for veterans' housing — we need 501(c)(3) status so donations are deductible.,"Business and Corporate > General (contracts, entities)",Business and Corporate > Non-Profit,"Business and Corporate > General (contracts, entities) || Business and Corporate > Non-Profit || Labor & Employment > ADA (Disability) Act Issues",True,True,True,1,Are you starting a for‑profit business or a nonprofit (charity) organization?,True,Are you starting a for‑profit business or a nonprofit (charity) organization?,Business and Corporate > Non-Profit || Taxation > Business & Corporate || Taxation > Estate & Gift,True,True,True,True,False,False,False,,26341
variability_b1_20260719T015046Z,v2_business_entity_specifics_06,business_entity_specifics,AtoB,routing_disambiguation,M2_specific_vs_general_fallback,false,Our board got a letter from a lawyer about the site next to our property and we don't know his angle.,The site is a Superfund cleanup area and the letter concerns contamination migration — this is environmental liability territory.,"Business and Corporate > General (contracts, entities)",Business and Corporate > Environmental,Real Property > Land Use/Zoning || Real Property > Homeowners Assoc || General Litigation > General Litigation,False,False,False,3,What kind of board are you on? || What is the lawyer’s letter mostly about? || Is the lawyer writing on behalf of the owner of the property next to yours?,True,What is the lawyer’s letter mostly about?,Business and Corporate > Environmental || Real Property > Environmental || General Litigation > Environmental,True,True,False,False,True,True,False,,36419
variability_b1_20260719T015046Z,v2_business_entity_specifics_10,business_entity_specifics,AtoB,routing_disambiguation,M2_specific_vs_general_fallback,false,A guy is making money off videos of my performances without any agreement with me.,"He's my former manager — there WAS a contract, and the fight is whether his expired management deal still gives him video rights. It's a contract fight, not raw infringement.",Intellectual Property > Entertainment,Business and Corporate > Entertainment,Intellectual Property > Trademark/Copyright || General Litigation > General Torts/Privacy || Business and Corporate > Entertainment,True,False,True,3,"Which of these best fits what he’s doing? || Are the performances you are referring to musical, acting, or something else? || Did you create the content yourself, or are you performing someone else's work?",False,,,,,True,True,False,False,False,,17100
variability_b1_20260719T015046Z,v2_business_entity_specifics_24,business_entity_specifics,AtoB,routing_disambiguation,M2_specific_vs_general_fallback,false,Our family restaurant got a violation notice that could close us and we don't understand our options.,It's the county health department over our outdoor kitchen setup — no liquor issue at all; it's a local administrative appeal.,Business and Corporate > Restaurants/OLCC,Administrative Law > General (Local/Municipal),Business and Corporate > Restaurants/OLCC || Administrative Law > General (Local/Municipal) || Administrative Law > General (State),True,True,True,3,Who sent the violation notice? || What does the notice say could happen if you don’t fix it? || Does the notice list a deadline or a hearing date?,True,Who sent the violation notice?,,,,True,True,False,False,False,,40336
variability_b1_20260719T015046Z,v2_business_entity_specifics_44,business_entity_specifics,AtoB,routing_disambiguation,M2_specific_vs_general_fallback,false,The city is making it impossible to run our food-truck commissary and we suspect favoritism.,They rezoned our block industrial-exclusive last month with no notice to us — challenging the rezoning process and grandfathering our use is the case.,Administrative Law > General (Local/Municipal),Real Property > Land Use/Zoning,"Administrative Law > General (Local/Municipal) || Business and Corporate > Restaurants/OLCC || Business and Corporate > General (contracts, entities)",True,True,True,3,"What is the city doing that is making it hard to run your food-truck commissary? || Did the city give you anything in writing (like a ticket/citation, denial letter, or notice) that explains why? || What state is this happening in?",True,What is the city doing that is making it hard to run your food-truck commissary?,"Real Property > Land Use/Zoning || Administrative Law > General (Local/Municipal) || Business and Corporate > General (contracts, entities)",True,True,False,False,True,True,False,,57553
variability_b1_20260719T015046Z,v2_business_entity_specifics_46,business_entity_specifics,AtoB,routing_disambiguation,M2_specific_vs_general_fallback,false,Our 501(c)(3) board discovered our treasurer has been 'borrowing' from the operating account.,"It's $240,000 over four years with forged countersignatures — the board's duty now includes referral to prosecutors and our D&O carrier, not just governance cleanup.",Business and Corporate > Non-Profit,Criminal Law > White Collar Crime,Business and Corporate > Non-Profit || General Litigation > Crime Victims || Business and Corporate > Litigation,True,True,True,2,What do you want help with most right now for your nonprofit (501(c)(3))? || Is the treasurer still a board member or still handling the nonprofit’s money (like having access to the bank account)?,True,What do you want help with most right now for your nonprofit (501(c)(3))?,Business and Corporate > Non-Profit || Criminal Law > White Collar Crime || General Litigation > Insurance (Liability),True,True,False,False,True,True,False,,56855
variability_b1_20260719T015046Z,v2_capacity_and_protection_01,capacity_and_protection,AtoB,routing_disambiguation,M3_missing_procedural_or_institutional_fact,false,I need to take over my father's finances before he loses everything. Where do I start?,"His dementia is advanced — his doctor says he no longer understands documents, so he can't sign anything voluntarily.",Wills & Trusts > Power of Attorney,Wills & Trusts > Conservatorship/Guardianship,Wills & Trusts > Power of Attorney || Wills & Trusts > Conservatorship/Guardianship,True,True,True,3,"Is your father able and willing to sign papers right now to let you handle his money (power of attorney, meaning written permission to act for him)? || Right now, can your father understand what’s going on and make his own choices? || What do you need to make decisions about for your father?",True,"Is your father able and willing to sign papers right now to let you handle his money (power of attorney, meaning written permission to act for him)?",,,,True,True,False,False,False,,43742
variability_b1_20260719T015046Z,v2_capacity_and_protection_07,capacity_and_protection,AtoB,routing_disambiguation,M3_missing_procedural_or_institutional_fact,false,I'm my dad's power of attorney and his care facility is questioning what I'm allowed to do.,"The POA only covers finances — the facility needs medical decisions made and dad can no longer consent, so I'm told I need guardianship for healthcare.",Wills & Trusts > Power of Attorney,Wills & Trusts > Conservatorship/Guardianship,Wills & Trusts > Power of Attorney || Wills & Trusts > Long-term Care Issues || General Litigation > Health Law/HIPAA,True,True,True,2,What kind of power of attorney do you have for your dad? || Is there already a court order like a guardianship or conservatorship for your dad?,True,What kind of power of attorney do you have for your dad?,Wills & Trusts > Conservatorship/Guardianship || Wills & Trusts > Power of Attorney,True,True,True,False,False,True,False,,21052
variability_b1_20260719T015046Z,v2_capacity_and_protection_26,capacity_and_protection,BtoA,routing_disambiguation,M3_missing_procedural_or_institutional_fact,false,We need a guardianship for my mother-in-law before she signs anything else her nephew puts in front of her.,"It's past prevention — he already had her deed him the rental duplex and add him to two accounts; clawing those back is the case, with any guardianship second.",Wills & Trusts > Conservatorship/Guardianship,Wills & Trusts > Elder Abuse,Wills & Trusts > Conservatorship/Guardianship || Wills & Trusts > Elder Abuse || Family Law > Other,True,True,True,3,What kind of help do you need for her decisions? || Has she already signed any papers giving the nephew control (like a power of attorney or adding him to accounts)? || Where does your mother-in-law live (state)?,True,Has she already signed any papers giving the nephew control (like a power of attorney or adding him to accounts)?,Wills & Trusts > Conservatorship/Guardianship || Wills & Trusts > Elder Abuse || Wills & Trusts > Litigation,True,True,True,True,False,False,False,,39282
variability_b1_20260719T015046Z,v2_capacity_and_protection_42,capacity_and_protection,AtoB,routing_disambiguation,M3_missing_procedural_or_institutional_fact,false,The hospital won't release my brother to my care even though I'm all the family he has.,"He's on an involuntary psychiatric hold — the county filed for commitment and the hearing is Thursday; that proceeding, not guardianship, decides everything right now.",Wills & Trusts > Conservatorship/Guardianship,Criminal Law > Mental Commitment,Wills & Trusts > Conservatorship/Guardianship || General Litigation > Health Law/HIPAA || Family Law > Guardianship,True,True,True,3,"Is your brother an adult (18 or older) or a minor (under 18)? || Do you already have any legal papers that let you make medical decisions for your brother, like a power of attorney (paper that lets you act for him) or a health care directive (paper that says what medical care he wants)? || What do you need help with right now?",False,,,,,False,False,False,False,False,,38663
variability_b1_20260719T015046Z,v2_capacity_and_protection_43,capacity_and_protection,AtoB,routing_disambiguation,M3_missing_procedural_or_institutional_fact,false,Mom's caregiver quit suddenly and we found months of unopened mail including scary bank letters.,The scariest letter is a notice of trustee sale — her reverse mortgage defaulted on taxes and insurance while the mail piled up; the sale is in five weeks.,Wills & Trusts > Elder Abuse,Real Property > Foreclosure,Wills & Trusts > Elder Abuse || Wills & Trusts > Conservatorship/Guardianship || Wills & Trusts > Power of Attorney,True,True,True,3,"Can your mom understand what’s going on and make her own decisions right now? || Do you think the caregiver stole money, used your mom’s money wrong, or harmed/neglected her? || What kind of letters did you find in the unopened mail?",True,What kind of letters did you find in the unopened mail?,,,,False,False,False,False,False,,38752
variability_b1_20260719T015046Z,v2_capacity_and_protection_45,capacity_and_protection,BtoA,routing_disambiguation,M3_missing_procedural_or_institutional_fact,false,The bank froze Dad's accounts because two different relatives showed up with 'authority' documents.,Both documents are POAs Dad signed at different times — he's competent and mortified; revoking both and executing one clean POA solves it without any court.,Wills & Trusts > Conservatorship/Guardianship,Wills & Trusts > Power of Attorney,Wills & Trusts > Power of Attorney || Wills & Trusts > Conservatorship/Guardianship || Debtor/Creditor > General (Creditor),True,True,True,3,"What kind of papers did your relatives show the bank to prove they could control your dad’s money? || Is your dad still able to understand things and make his own money decisions? || Right now, who should be the person in charge of your dad’s bank accounts?",True,What kind of papers did your relatives show the bank to prove they could control your dad’s money?,Wills & Trusts > Power of Attorney || Wills & Trusts > Litigation,True,True,True,True,False,False,False,,50304
variability_b1_20260719T015046Z,v2_charge_severity_01,charge_severity,AtoB,routing_disambiguation,M4_competing_framings_of_one_dispute,false,I got arrested after a fight outside a bar that I didn't start. I need a criminal defense lawyer.,"The paperwork says Assault III because the other guy's jaw was broken, and they told me that's a felony.",Criminal Law > Misdemeanor,Criminal Law > Lesser Felony,Criminal Law > Misdemeanor || Criminal Law > Lesser Felony || Criminal Law > Other,True,True,True,2,Do you know if the charge is a misdemeanor or a felony? || Were you charged with a misdemeanor or a felony?,True,Do you know if the charge is a misdemeanor or a felony?,Criminal Law > Major Felony,True,False,True,True,False,False,True,,18260
variability_b1_20260719T015046Z,v2_charge_severity_02,charge_severity,BtoA,routing_disambiguation,M4_competing_framings_of_one_dispute,false,The police charged me with assault after an argument with my brother-in-law got physical. I'm terrified.,"The complaint says Assault IV, a Class A misdemeanor; nobody was seriously hurt.",Criminal Law > Lesser Felony,Criminal Law > Misdemeanor,Criminal Law > Misdemeanor || Criminal Law > Lesser Felony || General Litigation > Crime Victims,True,True,True,2,"Do you know if the assault charge is a misdemeanor (lower-level) or a felony (more serious), or are you not sure? || Did you hurt your brother-in-law badly enough that he needed to go to the hospital?",True,"Do you know if the assault charge is a misdemeanor (lower-level) or a felony (more serious), or are you not sure?",,,,True,True,False,False,False,,15444
variability_b1_20260719T015046Z,v2_charge_severity_17,charge_severity,BtoA,routing_disambiguation,M4_competing_framings_of_one_dispute,false,I was charged over an incident at work where money went missing from the till.,The charge is misdemeanor Theft III; the till was short $95.,Criminal Law > Lesser Felony,Criminal Law > Misdemeanor,Criminal Law > Misdemeanor || Criminal Law > Lesser Felony || Business and Corporate > Litigation,True,True,True,3,"Is this mainly about criminal charges, a problem at work (like getting fired), or both? || About how much money do they say went missing from the register (till)? || Do you already have a criminal court date for this charge?",True,About how much money do they say went missing from the register (till)?,,,,True,True,False,False,False,,46286
variability_b1_20260719T015046Z,v2_charge_severity_22,charge_severity,BtoA,routing_disambiguation,M4_competing_framings_of_one_dispute,false,I'm charged over a fight at my kid's hockey game that the other guy started on video.,"The complaint charges Harassment and Disorderly Conduct II — both misdemeanors, no injury alleged.",Criminal Law > Lesser Felony,Criminal Law > Misdemeanor,Criminal Law > Misdemeanor || Criminal Law > Lesser Felony || General Litigation > Crime Victims,True,True,True,3,"Are you the one facing criminal charges, or are you asking for help as the victim of a crime? || Do you know if the charge is a misdemeanor (less serious crime) or a felony (more serious crime)? || Were you arrested, or were you given a ticket/citation and told to go to court later?",True,Do you know if the charge is a misdemeanor (less serious crime) or a felony (more serious crime)?,Criminal Law > Misdemeanor || Criminal Law > Local Ordinances || Criminal Law > Post Conviction/Appeals,True,True,True,True,False,False,False,,34708
variability_b1_20260719T015046Z,v2_charge_severity_24,charge_severity,AtoB,routing_disambiguation,M4_competing_framings_of_one_dispute,false,I got charged after defending myself outside my apartment when a drunk guy came at me.,"Because I had my pocketknife out, they filed Unlawful Use of a Weapon — a felony — on top of the assault count.",Criminal Law > Misdemeanor,Criminal Law > Lesser Felony,Criminal Law > Misdemeanor || General Litigation > Crime Victims || Criminal Law > Lesser Felony,True,True,True,3,"Do you know what level of charge you’re facing? || Were you charged with a crime, or did you press charges against the other person? || What kind of crime were you charged with?",True,What kind of crime were you charged with?,Criminal Law > Major Felony || Criminal Law > Lesser Felony || Criminal Law > Misdemeanor,True,True,True,True,False,False,False,,43391
variability_b1_20260719T015046Z,v2_charge_severity_27,charge_severity,AtoB,routing_disambiguation,M4_competing_framings_of_one_dispute,false,I'm being prosecuted over money from my grandmother's accounts that I was helping her manage.,"The indictment charges first-degree Criminal Mistreatment and Aggravated Theft — they total it at $180,000 over four years.",Criminal Law > Misdemeanor,Criminal Law > Major Felony,Wills & Trusts > Litigation || Criminal Law > White Collar Crime || Criminal Law > Major Felony,True,False,True,3,Do you know what crime you are being charged with? || Is the charge filed as a felony (more serious) or a misdemeanor (less serious)? || Did you have any legal paperwork that let you manage your grandmother’s money?,True,Do you know what crime you are being charged with?,Criminal Law > Major Felony || General Litigation > Crime Victims || Criminal Law > White Collar Crime,True,True,True,True,False,False,False,,43968
