run,scenario_id,boundary_id,direction,flip_type,mechanism,safety_sensitive,opening_query,hidden_fact,expected_initial_label,expected_final_label,initial_labels,initial_category_present,initial_exact_present,plausible_initial_present,follow_up_question_count,follow_up_questions,question_matched,matched_question,final_labels,final_category_present,final_exact_present,expected_final_category_present_initially,expected_final_exact_present_initially,expected_final_category_added,expected_final_exact_added,expected_final_exact_lost,provider_error,latency_ms
variability_b1_20260719T015046Z,v2_professional_negligence_45,professional_negligence,AtoB,label_change,M2_specific_vs_general_fallback,false,My realtor 'forgot' to submit our counteroffer and we lost the house we'd been chasing for a year.,We learned she 'forgot' because the winning buyer was her own brother-in-law — the real-estate board complaint for the license violation is the lever we want pulled first.,General Litigation > General Litigation,Administrative Law > Professional Licensing,"Real Property > General (Residential) || Business and Corporate > General (contracts, entities) || General Litigation > General Litigation",True,True,True,3,"Is your issue mainly about (1) your agent’s mistake and a possible claim against them, or (2) trying to enforce a deal for the house? || Did you have a written agreement with your realtor? || Did you sign a contract with the realtor?",True,"Is your issue mainly about (1) your agent’s mistake and a possible claim against them, or (2) trying to enforce a deal for the house?",General Litigation > General Litigation || Administrative Law > Professional Licensing || General Litigation > General Torts/Privacy,True,True,False,False,True,True,False,,37378
variability_b1_20260719T015046Z,v2_protective_order_relationship_10,protective_order_relationship,BtoA,routing_disambiguation,M3_missing_procedural_or_institutional_fact,true,My sister's ex keeps coming to our house looking for her and it's frightening everyone.,"The order would be for ME — he's threatened me personally at my door, and I've never had any relationship with him; my sister doesn't even live here anymore.",Family Law > Restraining Orders,General Litigation > Stalking Orders,Family Law > Restraining Orders || General Litigation > Stalking Orders || Family Law > Domestic Violence,True,True,True,3,Has your sister's ex ever threatened anyone in your household? || Is your sister's ex-husband threatening you or your family? || Has your sister already filed a police report or a court order to stay away?,True,Is your sister's ex-husband threatening you or your family?,General Litigation > Stalking Orders || Family Law > Restraining Orders,True,True,True,True,False,False,False,,33586
variability_b1_20260719T015046Z,v2_protective_order_relationship_12,protective_order_relationship,AtoB,routing_disambiguation,M3_missing_procedural_or_institutional_fact,true,Someone I had to fire keeps contacting me at home and my family is getting scared.,"His lawyer just filed a wrongful termination suit and the contact is about that — my business partner says we need employment counsel for the company, which worries me more than the calls.",General Litigation > Stalking Orders,Labor & Employment > General - Employer,General Litigation > Stalking Orders || General Litigation > Online Harrassment/Doxing/Bullying || General Litigation > Personal Injury,True,True,True,3,Has this person threatened you or your family? || How is this person contacting you? || Have you tried to get a court order to stay away (a judge’s order that tells them not to contact you or come near you)?,True,How is this person contacting you?,Labor & Employment > Wrongful Discharge - Employer || Labor & Employment > General - Employer || Labor & Employment > Wrongful Discharge - Employee,True,True,False,False,True,True,False,,37226
variability_b1_20260719T015046Z,v2_protective_order_relationship_24,protective_order_relationship,AtoB,routing_disambiguation,M3_missing_procedural_or_institutional_fact,true,Someone put a tracker on my car. The police found it but say their hands are tied for now.,"The receipts trace it to my husband — we're separated, and I'm told that makes it the family-abuse order process.",General Litigation > Stalking Orders,Family Law > Restraining Orders,General Litigation > Stalking Orders || Family Law > Domestic Violence,True,True,True,3,"Do you know who put the tracker on your car? || What kind of help do you want right now? || Is the same person also bothering you in other ways (like following you, showing up, calling/texting a lot, or bothering you online)?",True,Do you know who put the tracker on your car?,General Litigation > Stalking Orders || Family Law > Restraining Orders,True,True,True,False,False,True,False,,33052
variability_b1_20260719T015046Z,v2_protective_order_relationship_41,protective_order_relationship,AtoB,routing_disambiguation,M3_missing_procedural_or_institutional_fact,true,Someone slashed my tires twice this month and I have a good idea who it is.,"It's my wife's ex-husband — he did the same to her car before ours; she and I both need protection, and he's her former spouse.",General Litigation > Stalking Orders,Family Law > Restraining Orders,General Litigation > Crime Victims || General Litigation > Property Damage || General Litigation > Stalking Orders,True,True,True,3,"What kind of help do you want with the slashed tires? || Have you already reported the tire slashing to the police? || Do you have any proof it was this person (like video, photos, texts, a witness, or they admitted it)?",True,What kind of help do you want with the slashed tires?,,,,False,False,False,False,False,,53486
variability_b1_20260719T015046Z,v2_protective_order_relationship_43,protective_order_relationship,AtoB,routing_disambiguation,M3_missing_procedural_or_institutional_fact,true,"A man I met online turned frightening when I stopped responding, and now he references my workplace.","He's three states away and everything is digital — posts, emails, fake accounts; the platform-takedown and unmasking work matters more than a local order he'd never see.",General Litigation > Stalking Orders,General Litigation > Online Harrassment/Doxing/Bullying,General Litigation > Online Harrassment/Doxing/Bullying || General Litigation > Stalking Orders || General Litigation > Health Law/HIPAA,True,True,True,3,"What is he doing that worries you the most right now? || Since you stopped replying, how has he contacted you or brought you up? || Has he threatened you, like saying he will hurt you, ruin your job, or share private info?",True,"Since you stopped replying, how has he contacted you or brought you up?",General Litigation > Online Harrassment/Doxing/Bullying || General Litigation > Libel/Slander/Defamation,True,True,True,True,False,False,False,,51645
variability_b1_20260719T015046Z,v2_protective_order_relationship_64,protective_order_relationship,AtoB,routing_disambiguation,M3_missing_procedural_or_institutional_fact,true,The man I reported for vandalizing my car has now taken to standing across from my shop for hours.,"He was convicted of felony mischief for the car — the standing-around began after sentencing, and my main goal now is the civil damages case the conviction makes easy, alongside safety.",General Litigation > Stalking Orders,General Litigation > Crime Victims,General Litigation > Stalking Orders || General Litigation > General Torts/Privacy || General Litigation > Crime Victims,True,True,True,3,"What is your relationship to this man? || Besides standing across from your shop, has he done anything else to scare you or bother you? || Have you talked to the police about him standing near your shop (not just the car damage)?",True,"Besides standing across from your shop, has he done anything else to scare you or bother you?",General Litigation > Crime Victims || General Litigation > Stalking Orders || General Litigation > Property Damage,True,True,True,True,False,False,False,,47294
variability_b1_20260719T015046Z,v2_relationship_legal_status_02,relationship_legal_status,BtoA,routing_disambiguation,M3_missing_procedural_or_institutional_fact,false,My ex is keeping the house we bought together and says I have no rights to it.,"We're actually still legally married — separated for three years but nobody ever filed, so this belongs in a divorce case.",Family Law > Informal Living Arrangements,Family Law > General (Divorce/Separation etc.),Family Law > General (Divorce/Separation etc.) || Real Property > Litigation || Real Property > General (Residential),True,False,True,3,"Were you and your ex married when you bought the house? || Whose name is on the deed (title) to the house? || Is there a divorce case, separation case, or court order that says who gets the house?",True,"Is there a divorce case, separation case, or court order that says who gets the house?",Family Law > General (Divorce/Separation etc.) || Real Property > Litigation || Real Property > General (Residential),True,True,True,True,False,False,False,,43226
variability_b1_20260719T015046Z,v2_relationship_legal_status_04,relationship_legal_status,AtoB,routing_disambiguation,M3_missing_procedural_or_institutional_fact,false,"My girlfriend moved out and took things that we bought together, including the dog.","Honestly the property doesn't matter — it's the dog. I bought him, chipped him in my name, and want custody of him resolved.",Family Law > Informal Living Arrangements,General Litigation > Animal Law,Family Law > Informal Living Arrangements || Family Law > General (Divorce/Separation etc.) || General Litigation > Property Damage,True,True,True,3,"Were you and your girlfriend married or registered domestic partners (a legal relationship registered with the state)? || Whose name is on the dog’s papers (license, microchip, adoption or sale papers) and on receipts for the things you say you bought together? || What do you want help with in this situation?",True,What do you want help with in this situation?,General Litigation > Animal Law || Animal Law || General Litigation,True,True,True,False,False,True,False,,59404
variability_b1_20260719T015046Z,v2_relationship_legal_status_06,relationship_legal_status,AtoB,routing_disambiguation,M3_missing_procedural_or_institutional_fact,false,My boyfriend's name is on our lease and he's telling me I have to be out by Sunday.,I've paid half the rent by bank transfer for three years and get mail there — a tenant hotline told me I have tenancy rights and he can't just throw me out.,Family Law > Informal Living Arrangements,Real Property > Tenant (Residential),Real Property > Tenant (Residential) || Family Law > Informal Living Arrangements || Real Property > Landlord Residential,True,True,True,3,"Are you also on the lease, or is it only your boyfriend? || Have you gotten anything in writing from the landlord or a court saying you have to move out? || What do you want to happen?",False,,,,,True,True,False,False,False,,19809
variability_b1_20260719T015046Z,v2_relationship_legal_status_43,relationship_legal_status,AtoB,routing_disambiguation,M3_missing_procedural_or_institutional_fact,false,We ran a food cart together for five years and the breakup means someone gets the cart and the permits.,"The cart runs through an LLC we both own 50/50 — the split is a member buyout with permit transfers, entity work more than relationship work.",Family Law > Informal Living Arrangements,"Business and Corporate > General (contracts, entities)","Business and Corporate > General (contracts, entities) || Business and Corporate > Sale Of Business || Business and Corporate > Restaurants/OLCC",False,False,False,3,"How did you and your partner set up the food cart business? || Whose name are the permits and licenses in (like the health department, city permits, and any OLCC permit (Oregon Liquor and Cannabis Commission))? || Do you and your former business partner agree on who will keep the food cart and the permits?",True,How did you and your partner set up the food cart business?,"Business and Corporate > Sale Of Business || Business and Corporate > General (contracts, entities) || Real Property > Litigation",True,True,True,True,False,False,False,,69991
variability_b1_20260719T015046Z,v2_reputation_harm_type_03,reputation_harm_type,AtoB,routing_disambiguation,M4_competing_framings_of_one_dispute,false,A review posted about my restaurant is destroying us and it was written by our competitor.,"It's part of a whole campaign — fake reviews, poached staff under a broken non-compete, and copied menus; we want one business case against them, not just the review.",General Litigation > Libel/Slander/Defamation,Business and Corporate > Litigation,General Litigation > Libel/Slander/Defamation || Business and Corporate > Restaurants/OLCC || General Litigation > Online Harassment/Doxing/Bullying,True,True,True,3,Does the review say false facts about your restaurant (not just opinions like “I didn’t like the food”)? || What makes you think the competitor wrote the review? || Where was the review posted?,True,What makes you think the competitor wrote the review?,,,,True,False,False,False,False,,54886
variability_b1_20260719T015046Z,v2_reputation_harm_type_04,reputation_harm_type,AtoB,routing_disambiguation,M4_competing_framings_of_one_dispute,false,My teenager is being tormented by classmates on social media and the school shrugs it off.,"The school's own accounts are involved — staff let students run the 'official' class page where the worst posts live, and the district refuses to apply its anti-bullying policy. We want the district held to account.",General Litigation > Online Harrassment/Doxing/Bullying,Administrative Law > Student Rights,General Litigation > Online Harrassment/Doxing/Bullying || Administrative Law > Schools — Special Needs Education || Administrative Law > Student Rights,True,True,True,3,"What kind of school does your child attend? || Has the online bullying included threats to hurt your child, sharing private information, or sharing sexual images? || Have you reported the bullying to the school in writing, like an email or letter?",True,What kind of school does your child attend?,,,,True,True,False,False,False,,54696
variability_b1_20260719T015046Z,v2_reputation_harm_type_22,reputation_harm_type,BtoA,routing_disambiguation,M4_competing_framings_of_one_dispute,false,"My ex-business partner is telling suppliers I stole from the company, and it's killing my new venture.","There's a live dispute underneath — our dissolution agreement's earn-out and non-disparagement clauses; enforcing that contract is the cleaner, bigger case.",General Litigation > Libel/Slander/Defamation,Business and Corporate > Litigation,"General Litigation > Libel/Slander/Defamation || Business and Corporate > Litigation || Business and Corporate > General (contracts, entities)",True,True,True,3,Is it true or not true that you stole from the company? || How is your ex-business partner sharing this claim about you? || Do you and your ex-business partner have any written agreement that says you won’t bad-mouth each other (a non-disparagement clause) or limits what either of you can say about the other?,True,Do you and your ex-business partner have any written agreement that says you won’t bad-mouth each other (a non-disparagement clause) or limits what either of you can say about the other?,"General Litigation > Libel/Slander/Defamation || Business and Corporate > Litigation || Business and Corporate > General (contracts, entities)",True,True,True,True,False,False,False,,47329
variability_b1_20260719T015046Z,v2_reputation_harm_type_24,reputation_harm_type,AtoB,routing_disambiguation,M4_competing_framings_of_one_dispute,false,A parent at our school has spent months telling everyone a story about me that's simply not true.,"It's moved off words — she follows me through the parking lot, photographs my car, and showed up outside my house twice; I want a protective order, and we've never had any relationship.",General Litigation > Libel/Slander/Defamation,General Litigation > Stalking Orders,General Litigation > Libel/Slander/Defamation || General Litigation > Online Harrassment/Doxing/Bullying,True,True,True,2,How is the parent spreading the false story? || Did this parent spread the untrue story in writing (like emails or social media posts) or by telling people in person?,False,,,,,True,False,False,False,False,,13607
variability_b1_20260719T015046Z,v2_reputation_harm_type_42,reputation_harm_type,AtoB,routing_disambiguation,M4_competing_framings_of_one_dispute,false,My ex-employee's spouse runs a mommy blog that has been shredding my daycare by name for months.,"The posts recite details straight from our personnel files — my ex-employee is feeding confidential records in violation of her separation agreement, and enforcing that agreement is the lever.",General Litigation > Libel/Slander/Defamation,Labor & Employment > General - Employer,General Litigation > Libel/Slander/Defamation || General Litigation > Online Harrassment/Doxing/Bullying,True,True,True,2,"Do the blog posts make specific false statements about your daycare as facts (not just opinions), and has that hurt your daycare’s reputation? || Is the blogger in the United States?",False,,,,,False,False,False,False,False,,29038
variability_b1_20260719T015046Z,v2_reputation_harm_type_62,reputation_harm_type,AtoB,routing_disambiguation,M4_competing_framings_of_one_dispute,false,My landlord posted my photo in the lobby labeled 'DO NOT RENT — PROBLEM TENANT.',"The poster went up the day after I won my repair case against him — it's textbook retaliation under the tenant statutes, with penalties, and I still live here.",General Litigation > Libel/Slander/Defamation,Real Property > Tenant (Residential),Real Property > Tenant (Residential) || General Litigation > Libel/Slander/Defamation || Real Property > Landlord Residential,True,True,True,3,"Which best fits what you want help with right now? || Are you still living in this building as a tenant? || Did your landlord post your photo and label you a 'problem tenant' because of something related to your tenancy, or for another reason?",True,Are you still living in this building as a tenant?,Real Property > Tenant (Residential) || General Litigation > Libel/Slander/Defamation || Real Property > Landlord Residential,True,True,True,True,False,False,False,,33266
variability_b1_20260719T015046Z,v2_small_claims_vs_construction_05,small_claims_vs_construction,AtoB,routing_disambiguation,M2_specific_vs_general_fallback,false,Handyman charged us for materials he never bought and did work so badly we had to hire someone else.,"The redo involved structural framing and cost $22,000; the CCB told us to get a construction attorney.",Consumer Law > Small Claims Advice,Real Property > Construction/Contractors,Real Property > Construction/Contractors || General Litigation > General Torts/Privacy || Consumer Law > General,True,False,True,3,"Where was the handyman work done? || Did you have a written contract with the handyman? || Did the handyman do any work at all, or did he just take your money?",True,"Did the handyman do any work at all, or did he just take your money?",,,,True,True,False,False,False,,28260
variability_b1_20260719T015046Z,v2_small_claims_vs_construction_11,small_claims_vs_construction,BtoA,routing_disambiguation,M2_specific_vs_general_fallback,false,I need a construction attorney to go after the contractor who did our siding wrong.,"The repair is only $2,300, so every lawyer says it's really a small claims case I should file myself.",Real Property > Construction/Contractors,Consumer Law > Small Claims Advice,Real Property > Construction/Contractors || Business and Corporate > Construction || General Litigation > General Litigation,True,True,True,0,,False,,,,,False,False,False,False,False,,5651
variability_b1_20260719T015046Z,v2_small_claims_vs_construction_15,small_claims_vs_construction,BtoA,routing_disambiguation,M2_specific_vs_general_fallback,false,I want to sue my contractor. He installed the wrong windows and won't make it right.,"The price difference on the two windows is $2,100 and I'd rather file in small claims than pay attorney fees.",Real Property > Construction/Contractors,Consumer Law > Small Claims Advice,Real Property > Construction/Contractors || General Litigation > General Torts/Privacy,True,True,True,3,"Do you have a written contract (like an estimate, invoice, or text/email agreement) that says what windows the contractor was supposed to install? || Were the windows the contractor installed different from what you agreed to? || Have you already paid the contractor?",False,,,,,False,False,False,False,False,,17375
variability_b1_20260719T015046Z,v2_small_claims_vs_construction_18,small_claims_vs_construction,BtoA,routing_disambiguation,M2_specific_vs_general_fallback,false,A moving company damaged our furniture and won't honor their own claims process. I want to escalate.,"The damaged items total about $2,800 and I've decided to take them to small claims myself if someone explains the steps.",Consumer Law > General,Consumer Law > Small Claims Advice,Consumer Law > General || General Litigation > General Torts/Privacy || General Litigation > Property Damage,True,True,True,3,"Was the move in the same state, to a different state, or to another country? || In your moving agreement, what damage coverage did you choose (what the mover agreed to pay if they break something)? || About how much is the damaged property worth in total (a rough estimate is fine)?",True,About how much is the damaged property worth in total (a rough estimate is fine)?,Consumer Law > General || General Litigation > Property Damage || Consumer Law > Automobiles/RV's/Mobile Homes,True,False,True,False,False,False,False,,47177
variability_b1_20260719T015046Z,v2_small_claims_vs_construction_21,small_claims_vs_construction,AtoB,routing_disambiguation,M2_specific_vs_general_fallback,false,The company that waterproofed our basement did it so badly we now have standing water every rain.,"Mold remediation plus redoing the system is bid at $37,000, and the CCB complaint window closes soon.",Consumer Law > Small Claims Advice,Real Property > Construction/Contractors,Real Property > Construction/Contractors || General Litigation > Property Damage || General Litigation > General Torts/Privacy,False,False,True,1,"Did you hire the waterproofing company under a written contract (paperwork) or warranty, and did you pay them?",False,,,,,True,True,False,False,False,,39098
variability_b1_20260719T015046Z,v2_small_claims_vs_construction_44,small_claims_vs_construction,AtoB,routing_disambiguation,M2_specific_vs_general_fallback,false,We hired a 'friend of a friend' to finish our basement and he vanished mid-job with our money.,"The DA is prosecuting him — he did this to nine families, and we've been contacted as victims in the fraud case; I need to understand restitution before any civil filing.",Consumer Law > Small Claims Advice,Criminal Law > White Collar Crime,"Real Property > Construction/Contractors || General Litigation > General Torts/Privacy || Business and Corporate > General (contracts, entities)",False,False,True,2,"Did you and the contractor have a written agreement (like a signed contract, quote, or text messages about the price and work)? || How did you pay the contractor?",False,,,,,False,False,False,False,False,,21950
variability_b1_20260719T015046Z,v2_small_claims_vs_construction_45,small_claims_vs_construction,AtoB,routing_disambiguation,M2_specific_vs_general_fallback,false,The deck our contractor built failed its final inspection twice and he's blaming the inspector.,"The failures are structural — undersized beams and no lateral attachment — and correcting them means rebuilding half the $60,000 deck.",Consumer Law > Small Claims Advice,Real Property > Construction/Contractors,Real Property > Construction/Contractors || Real Property > General (Residential) || General Litigation > General Torts/Privacy,False,False,False,3,What kind of help do you need most right now? || What do you want to happen? || Is the contractor refusing to fix the deck?,False,,,,,True,True,False,False,False,,25771
variability_b1_20260719T015046Z,v2_small_claims_vs_construction_46,small_claims_vs_construction,BtoA,routing_disambiguation,M2_specific_vs_general_fallback,false,Our remodeler is threatening to sue US after we fired him for endless delays.,"His 'suit' is a small claims filing for $2,700 of disputed materials — I want coaching to defend it myself and counterclaim.",Real Property > Construction/Contractors,Consumer Law > Small Claims Advice,Real Property > Construction/Contractors || Business and Corporate > Litigation || Business and Corporate > Construction,True,True,True,3,"Is this remodel for the home you live in, or for a business building? || Did you have a written contract (a signed agreement) with the remodeler? || Besides delays, what was the main reason you fired the remodeler?",False,,,,,False,False,False,False,False,,32296
