run,scenario_id,boundary_id,direction,flip_type,mechanism,safety_sensitive,opening_query,hidden_fact,expected_initial_label,expected_final_label,initial_labels,initial_category_present,initial_exact_present,plausible_initial_present,follow_up_question_count,follow_up_questions,question_matched,matched_question,final_labels,final_category_present,final_exact_present,expected_final_category_present_initially,expected_final_exact_present_initially,expected_final_category_added,expected_final_exact_added,expected_final_exact_lost,provider_error,latency_ms
variability_b3_20260719T074220Z,v2_creditor_judgment_bankruptcy_22,creditor_judgment_bankruptcy,AtoB,routing_disambiguation,M3_missing_procedural_or_institutional_fact,false,The company that owes my consulting invoice keeps promising 'next quarter' while I fall behind on my own bills.,"Their 'next quarter' became a Chapter 11 filing yesterday — I'm unsecured for $28,000 and there's a claims-bar date coming.",Debtor/Creditor > General (Creditor),Bankruptcy > Creditors,"Debtor/Creditor > General (Creditor) || Business and Corporate > General (contracts, entities) || Business and Corporate > Litigation",True,True,True,3,"How much money does the company owe you for your consulting work? || Do you have a written agreement, like a contract or emails, that shows the amount the company owes you? || Is the company that owes you money located in the same state as you?",True,How much money does the company owe you for your consulting work?,"Bankruptcy > Creditors || Business and Corporate > General (contracts, entities) || Debtor/Creditor > General (Creditor)",True,True,False,False,True,True,False,,36850
variability_b3_20260719T074220Z,v2_creditor_judgment_bankruptcy_24,creditor_judgment_bankruptcy,AtoB,routing_disambiguation,M3_missing_procedural_or_institutional_fact,false,Our HOA can't collect dues from one owner and it's forcing the rest of us to cover the gap.,"He filed Chapter 13 — the board got the notice, and our lien and the arrears are now tangled in his plan; the association needs bankruptcy counsel.",Real Property > Homeowners Assoc,Bankruptcy > Creditors,Real Property > Homeowners Assoc,True,True,True,2,Is the owner who isn't paying in bankruptcy? || Is the owner who isn't paying trying to sell their home?,True,Is the owner who isn't paying in bankruptcy?,"Real Property > Homeowners Assoc || Bankruptcy > Creditors || Business and Corporate > General (contracts, entities)",True,True,False,False,True,True,False,,17045
variability_b3_20260719T074220Z,v2_creditor_judgment_bankruptcy_26,creditor_judgment_bankruptcy,AtoB,routing_disambiguation,M3_missing_procedural_or_institutional_fact,false,We won at trial against our old contractor but he transferred everything to his wife's name.,"The transfers happened the week after the verdict — our lawyer says that's a fraudulent-conveyance lawsuit against both of them, a new case, not just collection paperwork.",Debtor/Creditor > Judgment Collection,General Litigation > General Litigation,Debtor/Creditor > Judgment Collection || General Litigation > General Litigation || Business and Corporate > Litigation,True,True,True,2,Did the court order the contractor to pay you money (a judgment)? || Do you think the contractor moved money or property into his wife’s name to avoid paying you?,True,Do you think the contractor moved money or property into his wife’s name to avoid paying you?,Debtor/Creditor > Judgment Collection || General Litigation > General Litigation || General Litigation > Tort Claims Act,True,True,True,True,False,False,False,,33557
variability_b3_20260719T074220Z,v2_creditor_judgment_bankruptcy_41,creditor_judgment_bankruptcy,AtoB,routing_disambiguation,M3_missing_procedural_or_institutional_fact,false,My ex-tenant owes me for a year of damage and unpaid rent and laughed when I said I'd sue.,"He laughed because he'd already filed Chapter 7 — I'm listed in his schedules, and I want to challenge discharge of the damage he did intentionally.",Real Property > Landlord Residential,Bankruptcy > Creditors,Real Property > Landlord Residential || Debtor/Creditor > Judgment Collection || Debtor/Creditor > General (Creditor),True,True,True,2,"Are you trying to get money for unpaid rent, or for damage to the property, or both? || Do you have a written lease agreement with the tenant?",True,"Are you trying to get money for unpaid rent, or for damage to the property, or both?",,,,False,False,False,False,False,,20219
variability_b3_20260719T074220Z,v2_creditor_judgment_bankruptcy_44,creditor_judgment_bankruptcy,AtoB,routing_disambiguation,M3_missing_procedural_or_institutional_fact,false,Our nonprofit is owed a large grant reimbursement from a partner agency that keeps stalling.,"The 'partner agency' is the state housing department — recovering from a state agency runs through administrative claim procedures, not collection letters.",Debtor/Creditor > General (Creditor),Administrative Law > General (State),"Business and Corporate > Non-Profit || Debtor/Creditor > General (Creditor) || Business and Corporate > General (contracts, entities)",True,True,True,3,"Who owes your nonprofit the grant reimbursement? || Do you have something in writing that says they must pay you back (like a grant agreement, reimbursement agreement, or contract)? || Have you already filed a court case and gotten a judgment (a court order saying they owe you money) for this reimbursement?",True,Who owes your nonprofit the grant reimbursement?,Administrative Law > General (State) || Business and Corporate > Non-Profit || Debtor/Creditor > Judgment Collection,True,True,False,False,True,True,False,,34739
variability_b3_20260719T074220Z,v2_criminal_posture_01,criminal_posture,AtoB,routing_disambiguation,M3_missing_procedural_or_institutional_fact,false,I need a lawyer for my criminal case. The public defender isn't fighting for me at all.,I was already convicted at trial in March; I want the conviction appealed because of what the judge let in.,Criminal Law > Misdemeanor,Criminal Law > Post Conviction/Appeals,Criminal Law > Other || Criminal Law > Post Conviction/Appeals || Criminal Law > Lesser Felony,True,False,True,3,What kind of charge is your case? || What kind of crime are you accused of? || What type of criminal case do you have?,False,,,,,True,True,False,False,False,,8548
variability_b3_20260719T074220Z,v2_criminal_posture_02,criminal_posture,AtoB,routing_disambiguation,M3_missing_procedural_or_institutional_fact,false,I want my record cleared from an arrest that has been ruining my job applications.,"The case is actually still open — I missed a court date, so there's a pending charge and a warrant.",Criminal Law > Expunction,Criminal Law > Misdemeanor,Criminal Law > Expunction || Criminal Law > Other,True,True,True,0,,False,,,,,True,False,False,False,False,,3582
variability_b3_20260719T074220Z,v2_criminal_posture_12,criminal_posture,BtoA,routing_disambiguation,M3_missing_procedural_or_institutional_fact,false,I want to appeal what happened in my criminal case. The whole thing was handled wrong.,Nothing is decided yet — the misdemeanor trial is next month; I want a different lawyer before it starts.,Criminal Law > Post Conviction/Appeals,Criminal Law > Misdemeanor,Criminal Law > Post Conviction/Appeals,True,True,True,1,Which of these fits best?,False,,,,,True,False,False,False,False,,17612
variability_b3_20260719T074220Z,v2_criminal_posture_25,criminal_posture,AtoB,routing_disambiguation,M3_missing_procedural_or_institutional_fact,false,I served my sentence and now the state wants to keep punishing me in a new way.,"The 'new way' is lifetime registration — I finished everything ten years ago, have a spotless record, and want relief from the registration requirement.",Criminal Law > Post Conviction/Appeals,Criminal Law > Relief From Sex Offender Registration,Criminal Law > Parole/Probation || Criminal Law > Post Conviction/Appeals || Criminal Law > Relief From Sex Offender Registration,True,True,True,2,"What is the new thing the state is trying to make you do, after you finished your time? || What kind of new punishment is the state trying to give you?",True,"What is the new thing the state is trying to make you do, after you finished your time?",Criminal Law > Relief From Sex Offender Registration,True,True,True,True,False,False,False,,28291
variability_b3_20260719T074220Z,v2_criminal_posture_45,criminal_posture,AtoB,routing_disambiguation,M3_missing_procedural_or_institutional_fact,false,My conviction is from 1998 and I've been told different things about whether anything can be done.,"It's the registration that rules my life — housing, work, everything; the statute now allows relief petitions for my tier after 20 years clean, and I qualify.",Criminal Law > Expunction,Criminal Law > Relief From Sex Offender Registration,Criminal Law > Expunction || Criminal Law > Post Conviction/Appeals || Criminal Law > Clemency,True,True,True,3,"What do you want help with for your 1998 case? || What state was the case in, and what court was it in (if you know)? || Was it a felony or a misdemeanor, and what was the charge (if you know)?",True,What do you want help with for your 1998 case?,Criminal Law > Relief From Sex Offender Registration,True,True,True,False,False,True,False,,50345
variability_b3_20260719T074220Z,v2_criminal_posture_66,criminal_posture,AtoB,routing_disambiguation,M3_missing_procedural_or_institutional_fact,true,My brother called 911 during his crisis and somehow ended up the one facing consequences.,"No charges were filed — the 'consequences' are a civil commitment petition from the crisis team, with a hearing in six days where he needs counsel.",Criminal Law > Misdemeanor,Criminal Law > Mental Commitment,Criminal Law > Other || Criminal Law > Mental Commitment || General Litigation > Actions Against Police,True,False,True,3,"After your brother called 911, what happened next? || Where is your brother right now? || Was your brother hurt during the incident?",True,"After your brother called 911, what happened next?",,,,True,True,False,False,False,,36566
variability_b3_20260719T074220Z,v2_custody_safety_06,custody_safety,AtoB,label_change,M1_core_vs_secondary_issue,true,I adopted my nieces and my ex-partner is forcing visits they're refusing to go to. There's a case number already.,"My ex has two past domestic abuse convictions against me and the behavior is continuing — I want protection for me and the girls, not just a schedule change.",Family Law > Child Custody/Visitation,Family Law > Restraining Orders,Family Law > Child Custody/Visitation || Family Law > Restraining Orders || Family Law > Grandparent/Third Party Rights,True,True,True,3,Is there a court order that says your nieces must visit your ex? || What is your ex’s legal relationship to the children? || What do you want the court to do about the visits?,True,What do you want the court to do about the visits?,Family Law > Domestic Violence || Family Law > Restraining Orders || Family Law > Child Custody/Visitation,True,True,True,True,False,False,False,,40505
variability_b3_20260719T074220Z,v2_custody_safety_07,custody_safety,AtoB,label_change,M1_core_vs_secondary_issue,true,My son's mother took him and won't tell me where they are. I have court-ordered parenting time.,Her sister finally told me they flew to her home country — she has family there and no plans to return.,Family Law > Child Custody/Visitation,International Law > Family Law,Family Law > Child Custody/Visitation || Family Law > Parental Responsibility,True,True,True,3,Do you have a court order that says you have parenting time with your son? || Do you have a court order for custody or visitation? || Do you know which state your son is in?,True,Do you know which state your son is in?,Family Law > Child Custody/Visitation,False,False,False,False,False,False,False,,27832
variability_b3_20260719T074220Z,v2_custody_safety_13,custody_safety,AtoB,label_change,M1_core_vs_secondary_issue,true,The father of my baby refuses to help with anything and denies she's even his.,"We were never married and he's not on the birth certificate — no legal parentage exists yet, which I'm told has to come first.",Family Law > Child Support/Modification,Family Law > Paternity,Family Law > Paternity || Family Law > Child Support/Modification,True,True,True,1,What do you want help with right now?,True,What do you want help with right now?,,,,True,True,False,False,False,,41455
variability_b3_20260719T074220Z,v2_custody_safety_14,custody_safety,AtoB,label_change,M1_core_vs_secondary_issue,true,I pay child support every month but I haven't been allowed to see my kids since March.,"We were never married and I never established legal paternity — the support was a voluntary arrangement, and apparently I have no enforceable visitation rights until parentage is legal.",Family Law > Child Custody/Visitation,Family Law > Paternity,Family Law > Child Support/Modification || Family Law > Child Custody/Visitation,True,True,True,3,"Do you already have a court order about custody/parenting time (a schedule for visits)? || Is there any court order to stay away (a court order that says you must not contact the other parent or the kids)? || Are you looking for help with child support payments, or with seeing your kids?",True,Do you already have a court order about custody/parenting time (a schedule for visits)?,Family Law > Paternity || Family Law > Child Custody/Visitation,True,True,True,False,False,True,False,,39998
variability_b3_20260719T074220Z,v2_custody_safety_45,custody_safety,AtoB,label_change,M1_core_vs_secondary_issue,true,"My son's school keeps calling me instead of his mother even on her weeks, and it's causing fights.","The school calls me because on her weeks he's been caught twice vandalizing lockers — the district is now billing us for damages, and that liability question is what I need handled.",Family Law > Child Custody/Visitation,Family Law > Parental Responsibility,Family Law > Child Custody/Visitation || Family Law > Parental Responsibility || Administrative Law > Schools — Special Needs Education,True,True,True,3,Do you have a custody or parenting plan (court order about custody and parenting time) that says who the school should call first or who makes school decisions? || Has the school gotten a copy of your current custody/parenting plan (court order)? || Does your son get special education services at school (like an IEP (school plan for special education) or a 504 plan (school accommodations plan))?,False,,,,,True,True,False,False,False,,35953
variability_b3_20260719T074220Z,v2_custody_safety_48,custody_safety,AtoB,label_change,M1_core_vs_secondary_issue,true,I just learned my ex has been recording every phone call I make to my children.,"He's also recording MY end of calls with my lawyer when the kids hand me over — our state requires all-party consent, and I want the interception itself pursued.",Family Law > Child Custody/Visitation,General Litigation > General Torts/Privacy,Family Law > Child Custody/Visitation || General Litigation > General Torts/Privacy || General Litigation > Tort Claims Act,True,True,True,3,"Is this mostly a child custody/parenting time problem, a privacy problem about recording calls, or both? || Do you already have a custody or parenting plan, or a court order, that says anything about phone or video calls with your kids (like whether the calls should be private)? || Are you and your ex in an open court case right now about the kids (like a custody case)?",True,"Is this mostly a child custody/parenting time problem, a privacy problem about recording calls, or both?",General Litigation > General Torts/Privacy || General Litigation > Crime Victims || Family Law > Child Custody/Visitation,True,True,True,True,False,False,False,,42516
variability_b3_20260719T074220Z,v2_custody_safety_62,custody_safety,AtoB,label_change,M1_core_vs_secondary_issue,true,My daughter's father hasn't seen her in three years and now suddenly demands weekends.,His 'demand' arrived the same week as my support-modification filing — his lawyer's letter even offers to drop the weekend demand if I drop the increase; it's a support-leverage play to answer inside the support case.,Family Law > Child Custody/Visitation,Family Law > Child Support/Modification,Family Law > Child Custody/Visitation,True,True,True,2,Do you already have a court order that sets custody and visit time? || Is there currently a court order about when the father can see your daughter?,False,,,,,True,False,False,False,False,,15177
variability_b3_20260719T074220Z,v2_custody_safety_63,custody_safety,AtoB,label_change,M1_core_vs_secondary_issue,true,My son came home from his dad's with bruises and a story that keeps changing.,"His pediatrician made the mandatory report yesterday — DHS is assessing both homes now, and everything runs through that assessment first.",Family Law > Child Custody/Visitation,Family Law > Juvenile/DHS Issues,General Litigation > Child Abuse Victims || Family Law > Child Custody/Visitation || Family Law > Restraining Orders,True,True,True,3,"What kind of help do you want most right now? || Do you already have a court order that says who has custody and what the visit schedule is? || Besides his dad, does anyone else watch your son or take care of him (like a babysitter, family member, or daycare)?",False,,,,,True,False,False,False,False,,21349
variability_b3_20260719T074220Z,v2_debt_posture_01,debt_posture,AtoB,routing_disambiguation,M3_missing_procedural_or_institutional_fact,false,A debt collector will not leave me alone about an old credit card and I can't take it anymore.,They call my workplace six times a day and told my coworker I'm a deadbeat who could be arrested.,Debtor/Creditor > General (Debtor),Debtor/Creditor > Collection/Harassment,Debtor/Creditor > Collection/Harassment,True,False,True,2,"Are they just calling/sending letters, or have you already been taken to court or had money taken from your paycheck/bank? || Is this about a credit card debt that you believe you already paid off or is not yours?",True,"Are they just calling/sending letters, or have you already been taken to court or had money taken from your paycheck/bank?",Debtor/Creditor > Collection/Harassment || Debtor/Creditor > General (Debtor),True,True,True,True,False,False,False,,39391
variability_b3_20260719T074220Z,v2_debt_posture_06,debt_posture,AtoB,routing_disambiguation,M3_missing_procedural_or_institutional_fact,false,My wages just got garnished without any warning and my rent check is going to bounce.,I was never served with the lawsuit — the collector swore they served me at an address I left five years ago.,Debtor/Creditor > General (Debtor),Debtor/Creditor > Collection/Harassment,Debtor/Creditor > Judgment Collection || Debtor/Creditor > Collection/Harassment || Debtor/Creditor > General (Debtor),True,True,True,2,Did you get any notice or court papers before your wages were garnished? || Do you know why your wages were garnished?,True,Did you get any notice or court papers before your wages were garnished?,Debtor/Creditor > Judgment Collection || Debtor/Creditor > Collection/Harassment,True,True,True,True,False,False,False,,33392
variability_b3_20260719T074220Z,v2_debt_posture_10,debt_posture,AtoB,routing_disambiguation,M3_missing_procedural_or_institutional_fact,false,The hospital sent my bill to collections even though I was making small payments every month.,The bill only exists because my health insurer wrongly denied the claim as 'not medically necessary' — I'm appealing that denial.,Debtor/Creditor > General (Debtor),General Litigation > Insurance (Health/Disability),Debtor/Creditor > Collection/Harassment || Consumer Law > Banking || Consumer Law > Other,True,False,False,3,"Did you have an agreement with the hospital about the payment plan? || Are you trying to dispute the bill itself, or how the collections agency is trying to get the money? || Did you get a court order saying you have to pay the full amount right away?",True,"Are you trying to dispute the bill itself, or how the collections agency is trying to get the money?",General Litigation > Insurance (Health/Disability) || Debtor/Creditor > Collection/Harassment || Consumer Law > Insurance,True,True,False,False,True,True,False,,35188
variability_b3_20260719T074220Z,v2_debt_posture_12,debt_posture,AtoB,routing_disambiguation,M3_missing_procedural_or_institutional_fact,false,My bank account was frozen this morning and I can't buy groceries. I don't even know who did this.,"The garnishment took my Social Security disability money, which the collector knows is protected income.",Debtor/Creditor > General (Debtor),Debtor/Creditor > Collection/Harassment,Consumer Law > Banking || Debtor/Creditor > Judgment Collection || Debtor/Creditor > Collection/Harassment,True,False,True,1,"Do you know why your bank account was frozen? For example, was it because of an unpaid debt, a court order, or something else?",True,"Do you know why your bank account was frozen? For example, was it because of an unpaid debt, a court order, or something else?",Debtor/Creditor > Collection/Harassment || Administrative Law > Social Security/SSI,True,True,True,True,False,False,False,,31250
variability_b3_20260719T074220Z,v2_debt_posture_21,debt_posture,AtoB,routing_disambiguation,M3_missing_procedural_or_institutional_fact,false,Medical bills from my heart surgery are burying us and the hospital's patience just ran out.,We have steady income and can pay 60% over time — we want someone to negotiate a structured settlement before they sue.,Debtor/Creditor > General (Debtor),Debtor/Creditor > Debt Counseling/Workouts,General Litigation > Personal Injury || Consumer Law > Banking || Consumer Law > Mortgage Issues (non-foreclosure),False,False,False,2,"Are these medical bills related to an injury you suffered, or are they just regular medical expenses? || Are you having trouble paying other bills besides the medical bills, like your mortgage or car payments?",False,,,,,False,False,False,False,False,,22595
variability_b3_20260719T074220Z,v2_debt_posture_24,debt_posture,AtoB,routing_disambiguation,M3_missing_procedural_or_institutional_fact,false,"The same debt collector calls me twenty times a day, even after I sent them a letter.","The 'collector' is actually the water district's own billing office, and they've now scheduled a shutoff over charges from a leak that was on THEIR side of the meter.",Debtor/Creditor > Collection/Harassment,Administrative Law > Utilities,,False,False,False,1,All classifier providers failed to return a response or no labels/questions were found.,False,,,,,False,False,False,False,False,,18416
variability_b3_20260719T074220Z,v2_debt_posture_25,debt_posture,AtoB,routing_disambiguation,M3_missing_procedural_or_institutional_fact,false,I co-signed a loan for my sister and now the lender is coming after me for all of it.,"She filed Chapter 13 — her plan proposes paying this loan, and I need someone protecting my position inside her case before the lender takes it out of me.",Debtor/Creditor > General (Debtor),Bankruptcy > Creditors,Debtor/Creditor > General (Debtor) || Debtor/Creditor > Collection/Harassment || Debtor/Creditor > General (Creditor),True,True,True,2,"Where are things right now with the lender? || Are you being asked to pay the loan because your sister didn't pay, or because you are both responsible for the loan?",True,Where are things right now with the lender?,,,,False,False,False,False,False,,37293
variability_b3_20260719T074220Z,v2_debt_posture_42,debt_posture,AtoB,routing_disambiguation,M3_missing_procedural_or_institutional_fact,false,My dead father's credit card company is calling ME about his balance every single day.,"I'm the named executor and his estate has assets — the right move is opening probate and handling claims properly, not fighting the calls.",Debtor/Creditor > Collection/Harassment,Wills & Trusts > Probate,Debtor/Creditor > Collection/Harassment || Wills & Trusts > Probate || Debtor/Creditor > General (Creditor),True,True,True,3,"Who is calling you about the balance? || What is your connection to the card or your dad’s estate? || Are you the executor or administrator of your father's estate, or are you being asked to pay the debt yourself?",True,"Are you the executor or administrator of your father's estate, or are you being asked to pay the debt yourself?",,,,True,True,False,False,False,,35269
variability_b3_20260719T074220Z,v2_discharge_reason_03,discharge_reason,AtoB,label_change,M1_core_vs_secondary_issue,false,After ten years with great reviews I suddenly got terminated. I think it was completely unfair.,My new manager had been making comments about my age and replaced me with someone in their twenties.,Labor & Employment > Wrongful Discharge - Employee,Labor & Employment > Discrimination - Employee,,False,False,False,1,All classifier providers failed to return a response or no labels/questions were found.,False,,,,,False,False,False,False,False,,28287
variability_b3_20260719T074220Z,v2_discharge_reason_06,discharge_reason,AtoB,label_change,M1_core_vs_secondary_issue,false,My boss fired me and I know the official reason is fake. What can I do about it?,"It happened a month after I told HR I was pregnant, and my duties were fine until then.",Labor & Employment > Wrongful Discharge - Employee,Labor & Employment > Discrimination - Employee,,False,False,False,1,All classifier providers failed to return a response or no labels/questions were found.,False,,,,,False,False,False,False,False,,20764
